{
  "artifact_hash": "sha256:097f173d4ac0f32803ba99aa642be8d73db7bd503e6347f84a8a4c9b7e207c12",
  "attestation": null,
  "bundle_ref": {
    "path": "run/run.kcprun",
    "sha256": "sha256:fe9749227f94888f460830884b04d7a4cfe44774b948b31634f1f5e944919ca3"
  },
  "hardware_claimed": false,
  "hil_contract_hash": "sha256:4f10bd579547c8d71526abfbf9ce9c79d8a78dc54d3b3c11b5e46dab4bd2d94b",
  "hil_status_hash": "sha256:3c9411d565d9934c07e6e887240941a7488b0550cdfcb6ae735e1faff4b33baf",
  "media": [],
  "notes": [
    "Generated by OpenDrop/EWOD dry-run adapter skeleton. No OpenDrop hardware IO or physical execution is claimed."
  ],
  "observation_hashes": [
    "sha256:374f5d198b9708f18bb67125e82764ff868871a4c7d4e5d23bf83ff635e25e92",
    "sha256:7265a5aec180afb17e3d66650865861df7922d8a1e572a2ac96216bf13e8075b"
  ],
  "raw_device_logs": [
    {
      "log_format": "jsonl",
      "log_id": "log-0001",
      "path": "raw/device-log.jsonl",
      "sha256": "sha256:2ef42ff2e38360830f04672d23491151f1806d8512636f46e55775913204382a",
      "source_type": "mock_hardware"
    }
  ],
  "recorded_run_id": "opendrop-ewod-dry-run-recorded-run",
  "recorded_run_version": "klein.recorded_device_run.v1",
  "runbook_hash": "sha256:69d0986d862ba895ba1aba12e80321b70b0d43e00c2fc1d7de453bde9ed581f4",
  "source_id": "opendrop_ewod_dry_run",
  "source_type": "mock_hardware",
  "source_version": "0.1.0-alpha",
  "trace_hash": "sha256:f412faf75db436e1cbb95b24e6138abb2812705c8640793865515a25bae630b9",
  "trusted_timestamp": null
}
