{
  "artifact_hash": "sha256:097f173d4ac0f32803ba99aa642be8d73db7bd503e6347f84a8a4c9b7e207c12",
  "attestation": null,
  "bundle_ref": {
    "path": "run/run.kcprun",
    "sha256": "sha256:fe9749227f94888f460830884b04d7a4cfe44774b948b31634f1f5e944919ca3"
  },
  "hardware_claimed": false,
  "hil_contract_hash": "sha256:19adffc39e2797acfe2746897893e1d4671a54164a6aa339f319c21b8089ec16",
  "hil_status_hash": "sha256:f65944966a5789981ddd02be18a05a2dfa4780abd507781a3c2eb8746a6a8ea8",
  "media": [],
  "notes": [
    "Generated by Generic DMF Dry-Run Adapter. No hardware IO or physical execution is claimed."
  ],
  "observation_hashes": [
    "sha256:0a5f18da51a8144e779815344415b19b8f5a2772e08a99a593947d92c17f78ef",
    "sha256:dcd779609768e0861827a560cb7cf7089196d4764e9e964204052368c4ab5a97"
  ],
  "raw_device_logs": [
    {
      "log_format": "jsonl",
      "log_id": "log-0001",
      "path": "raw/device-log.jsonl",
      "sha256": "sha256:ef6fb567a2e7e44fcc5261684902dbc461ec833836c43595f4123eb05575a652",
      "source_type": "mock_hardware"
    }
  ],
  "recorded_run_id": "dmf-dry-run-recorded-run",
  "recorded_run_version": "klein.recorded_device_run.v1",
  "runbook_hash": "sha256:69d0986d862ba895ba1aba12e80321b70b0d43e00c2fc1d7de453bde9ed581f4",
  "source_id": "generic_dmf_dry_run",
  "source_type": "mock_hardware",
  "source_version": "0.1.0-alpha",
  "trace_hash": "sha256:8f59b2cea8bea8140c278f25a94e6221ac104d22564b8c5ecc5c91a47955c82a",
  "trusted_timestamp": null
}
